Structure,Type of Work,Building Function,Neighborhood,New Square Feet,Building's Stories,New Residential Units,Construction Value,Description
Apartments,New Construction,Residential, Northwest District,215351.0,7.0,200.0,31232997.0,"BLOCK 290 - New 7-story, 200 unit mixed-use building with six stories of residential above ground floor retail and one story of below grade parking; includes amenity spaces and associated sitework *** w/ 20-182447 -MT *** "
Single Family Detached,Alteration,Residential,nan,936.0,,0.0,40742.0,SINGLE PDF- CONVERTING SFR TO SFR W/ DAYCARE-NO WORK PROPOSED. CHANGE OF USE ONLY
"Rowhouse, Townhouse, Duplex",Alteration,Residential,nan,900.0,,0.0,39175.0,"SINGLE PDF - ALTERATION TO CONVERT BASEMENT OF DUPLEX TO HABITABLE SPACE. ADDING FAMILY ROOMS, WINDOW WELLS, FUR OUT WALLS, AND REPLACEMENT OF EXISTING STAIRS"
Assembly,New Construction,Commercial," Centennial Community, Pleasant Valley",523.0,1.0,0.0,205000.0,PDOX LTD -  NEW SINGLE STORY RESTROOM BUILDING SITE IMPROVEMENTS AND UTILITIES TO CREATE A FOOD CART POD**WITH 20-140584 CO**
Accessory Structures,New Construction,Residential, Bridgeton,400.0,1.0,,0.0,NEW 24X30 DETACHED GARAGE to finalize permit 93-004678
Utility,New Construction,"Utility, Storage, Parking, Special"," Centennial Community, Pleasant Valley",185.0,1.0,0.0,15000.0,PDOX LTD - NEW TRASH ENCLOSURE **WITH 20-140576 CO**
